{
  "version": 1,
  "fund_keys": {
    "general_unrestricted": {
      "label": "General Unrestricted",
      "archetype": "unrestricted",
      "default_restriction_keys": []
    },
    "general_restricted": {
      "label": "General Restricted",
      "archetype": "temporarily_restricted",
      "default_restriction_keys": []
    },
    "welcome_home_reimbursement": {
      "label": "Welcome Home Kit Reimbursement",
      "archetype": "temporarily_restricted",
      "default_restriction_keys": ["grant_reporting"]
    }
  },
  "restriction_keys": {
    "local_only": {"label": "Local only"},
    "vet_only": {"label": "Veterans only"},
    "homeless_only": {"label": "Homeless only"},
    "grant_reporting": {"label": "Grant reporting required"}
  },
  "income_kinds": {
    "donation": {"label": "Donation"},
    "grant_disbursement": {"label": "Grant disbursement"},
    "reimbursement": {"label": "Reimbursement"},
    "inkind": {"label": "In-kind contribution"},
    "other": {"label": "Other income"}
  },
  "expense_kinds": {
    "food": {"label": "Food"},
    "fuel": {"label": "Fuel"},
    "supplies": {"label": "Supplies"},
    "lodging": {"label": "Lodging"},
    "printing": {"label": "Printing"},
    "software": {"label": "Software and IT"},
    "fees": {"label": "Bank and merchant fees"},
    "other": {"label": "Other expense"}
  },
  "spending_classes": {
    "basic_needs": {"label": "Basic needs"},
    "events": {"label": "Events"},
    "logistics": {"label": "Logistics"},
    "housing": {"label": "Housing"},
    "admin": {"label": "Administration"}
  }
}
